reviewId,userName,userImage,content,score,thumbsUpCount,reviewCreatedVersion,at,replyContent,repliedAt
gp:AOqpTOH-6xiEvMIXB75oBFB0nBh6TU7JKsj1Ona_TsCxyWhp6Fvms11wAo6VkauFe9Fp5oUnpXCyZ-EDPNdpLg,Sarah,https://play-lh.googleusercontent.com/a-/AOh14GjIExd1dwDmXOp0Bnh_rtSBiZZJlpcKI_mYV48pmg,"I really like the look and concept of the app. So far I've found a good handful of people I'd be interested in getting to know, however I am currently unable to respond to dm's which is unfortunate. I'm hoping thisget's fixed soon.",4,11,1.1.2,2021-01-18 02:37:45,,
gp:AOqpTOHS5qWfwunJ0f-3sYCeqYfsBMvlOE2BvCE-KG_g-CfjsFM4lolUGWEv9e6aa8i646VdmEhqxNPqk1te6g,Carson Gould,https://play-lh.googleusercontent.com/a-/AOh14Gj0TLFWT0NDz0kB-pwV2iX-7-V0oRvAh7RIZmbRag,"Been good so far but really don't like how you have to pay to see more people, I rather have a banner ad.",3,5,1.1.2,2021-01-18 00:54:17,,
gp:AOqpTOFyB44sIl8fRdP47mGNfQ1wnhIeXQCmD2NkQeib1qJVidZoAEbcgbl0SVSd81fcopJxE_YasC0LUo99UQ,James Ramos,https://play-lh.googleusercontent.com/-0X-r8p-tYJM/AAAAAAAAAAI/AAAAAAAAAAA/AMZuuclwnIosP8i-s8HbNSL5mF_0_gHcTA/photo.jpg,Impressive,5,0,1.0.25,2021-01-17 22:53:10,,
gp:AOqpTOGIR0E2v38zlffGMh1AnasBnQ7dnS3PT816hDQ8JZm8D1IhpcLZFOeKo63c3hbvjzLgxYE7GOVGVetMPA,Shawn Brown,https://play-lh.googleusercontent.com/-0xADDdNS5OI/AAAAAAAAAAI/AAAAAAAAAAA/AMZuuck0kQ9y9k_tVtRJfSj46SQ6uB_Vpg/photo.jpg,It's just what I wanted,5,0,1.0.23,2021-01-17 22:51:38,,
gp:AOqpTOFD9-BODigBbnpzSqBblTEfatv4GGv9dkSWoYsVoDv27ixKDNWc2jn1NPdPt_hPQMkCXgWZQKZmCsLaTg,john mullins,https://play-lh.googleusercontent.com/a-/AOh14Gi2TVvzfMHcfvXozXfBWeK6xepo_6IuaBMJAz9F6A,"I agree with some other folks, it's a nice interface but not enough matches in the area. Did the update this morning and getting service unavailable, hopefully it's fixed soon",3,7,1.1.2,2021-01-15 18:03:38,,
gp:AOqpTOFHb81psFI-QVeSydW83FqkEV3t8eMhxEjsAhvwMI0aTSS525b0yUNKtdozf9pt1ojehXZIjpthi4qcHg,Zack Robinson,https://play-lh.googleusercontent.com/a-/AOh14GgTslTtny-mlpz-lwjpBody5VmNfULcIWqR65swnQ,"Honestly, an amazing app with a great interface. Two issues for myself: I'm gay and it would show me straight men in my suggestions, which was a huge turn off. My suggestion is to either fix their algorithm or just have the compatability card be a mandatory card in the top of a person's bio. And the second thing is just a sheer lack of people on the app right now for it to be worth a lot of time.",4,0,,2021-01-15 17:56:45,,
gp:AOqpTOGH1hal_6lOuMT59D7bkl9ORtdXOg4Ca7Yb0Xq2oyD0MX8EpFa5IjdgRQ9tfc6URBhx3CNM9oiT6_Hrgw,Nicholas Middleton,https://play-lh.googleusercontent.com/-Bcr9iVDlURs/AAAAAAAAAAI/AAAAAAAAAAA/AMZuuckk3daQfRfkwGj-v2xmjN7KP6eHHw/photo.jpg,It is cool to use,5,0,1.0.17,2021-01-15 16:35:49,,
gp:AOqpTOFurp76ZFtnei6gNsAMb4BhlVLnoXAq1QFDZ_0TwtYItOGTPY-6VEEUL0rSWFOwqR1jkCX4BkGzgl60qQ,William Levy,https://play-lh.googleusercontent.com/-WOgv6gAgjxc/AAAAAAAAAAI/AAAAAAAAAAA/AMZuuclt-ui4LgMtWeTu1Q-laphZrR3sMQ/photo.jpg,ALL THE BEST,5,0,1.0.18,2021-01-15 00:08:31,,
gp:AOqpTOGGZJ7xnWZvbYOJUTD-vQjiDuyy29dTbGmBSBlJVMeuLL024pbK09F53_XVg6iPzIQOTP3fM3Sc8dRxOA,Bryan Helms,https://play-lh.googleusercontent.com/a-/AOh14GgbQ75G3udG4LdwnwPplobV3tOLHBhpQ7LDnkLT,Does not want to launch every time I open the app,3,0,1.1.2,2021-01-14 23:53:45,,
gp:AOqpTOFJRnDCGYifzDRFAtbVMrYUEfyJA-pkjDLSxdcoUDp32jVY1KhNrJBc0Ddr__W7l4BfxNSov8MNoXGq7A,Creepypasta Hoodie,https://play-lh.googleusercontent.com/a-/AOh14GhcQJe_MQ5gHP8WVNYbPsJLN1_w0h2STQhUyPCaUg,"After being on here for a while I got no matches and no conversations, how disappointing",1,0,,2021-01-14 06:07:32,,
gp:AOqpTOHMeCocKc9PcIMH_xZSBnDTX0TbatY2eMSw8aW7zagzZJs8QQH03ViEGhUyk9BNdhdxipLynMcxSYOAkw,Lincoln Hensley,https://play-lh.googleusercontent.com/-g0duhqTi92o/AAAAAAAAAAI/AAAAAAAAAAA/AMZuuckp7ID3zzasch-VonWHM8mYKZxteQ/photo.jpg,Very nice app. easy to use,5,0,1.0.25,2021-01-13 22:06:49,,
gp:AOqpTOH6bO_BwUeOWpX2LFmuxFRLG5_IzTqFd77_vaVMBe6LtqCA6bwmnKPLQ3HA-Berwe64lL9VOrSKoFK4qQ,Austin Dunlap,https://play-lh.googleusercontent.com/-I0yukzfLpVA/AAAAAAAAAAI/AAAAAAAAAAA/AMZuucl0YGKh4z78wpHH4PyoZqowr3xOOA/photo.jpg,Nice app for me,5,0,1.0.23,2021-01-13 16:26:07,,
gp:AOqpTOE9ZVbfNMAIMKUH7izu_7_VjI4WDSNPM7RrBnuc5bwrh3mPmeNlAFwgxUPrNgyMy2GQW1r-5_tAuDLrAQ,Ca Fr,https://play-lh.googleusercontent.com/a-/AOh14GgkW5RBv-XNkK5I0TwWCTs7R8wIML_sPOSbkqJUNQ,Great app. Lower priced premium than all other competitors as of January 2021 and really premium isn't a requirement if your patient. I would recommend adding a feature to specify which gaming platform your on and only search for those with the same set up.,5,0,,2021-01-13 08:06:10,,
gp:AOqpTOGjrVoC53OuMtHDdZEGjQWRg82im2Pfc-mL-x-hBu0RVTOmtTbHq7sgF4n4fJUiRKM694fnLrSPc0qRnw,Darii,https://play-lh.googleusercontent.com/a-/AOh14GhzQiYKORFxdmTLgmSDUYWb5YOtfnGiJIAefC1K,Barely loads. Farthest I've gotten is just after uploading pictures and it gets stuck on loading. Now it won't get last the initial load screen.,1,0,1.0.25,2021-01-13 02:22:25,,
gp:AOqpTOH5h39PUTsofTdN4FOsPJQU9xza4er18ZNZLTLSExOUTb0DOVfTRMlooGGdt-4C1thlPkIth5A8yre1rw,chanah vicary,https://play-lh.googleusercontent.com/-AyXBB4OpoKg/AAAAAAAAAAI/AAAAAAAAAAA/AMZuucljhqzAuc3EF-5XS2hTZBlS35QiYg/photo.jpg,I could not get past the birthday part,1,0,,2021-01-12 03:47:11,,
gp:AOqpTOFb5BKrDc81PY7oWAaflb8C5ZoWTYzvE_f8ZqmRBsEjoez74GbbVq-vRbxLBWiJvvb6YhHSbEPZ8_uZ6A,Xavier Everett,https://play-lh.googleusercontent.com/-wOAwcH9aTSQ/AAAAAAAAAAI/AAAAAAAAAAA/AMZuucmHTvYz04jlEQzpgr3MkBU3nyMrNA/photo.jpg,Very efficient!!,5,0,1.0.25,2021-01-11 15:45:50,,
gp:AOqpTOHSZPLPnfK9LTFmqZRGy4UXJnglk9h-kA8ZV6rJr4VmaAgdNE54S7I3RHN8L6ehFcytf34zgERsU2bP3w,Cloudius Andres,https://play-lh.googleusercontent.com/a-/AOh14GggENqLQyNIe4O9ci5nT59zDw9uu2azmCUSj5VSfw,Will never find my location no matter how much i keep granting access.,1,0,,2021-01-11 10:41:42,,
gp:AOqpTOGMNZeZDRqnKnqxh2k3T_9wQ0MQ8nt9T-qjCMiiyZ4CHXTSRK_0eON22HXv0hCYo19-r54H5GOHFQKwDA,Angel Valeriano,https://play-lh.googleusercontent.com/a-/AOh14GjWDuD2cXN2C_7DIUXXvfoXt_VN-VKYZZcmGkN2MA,Got this app and let it sit for quite a minute lol I decided to just maximize my use of the app and go crazy with likes. Stumbled upon a girl and boom it was all history from there. Thank you for introducing me to my cute Irish sweet heart 😭 she lives a few states over but I can make it work 💙 thank you KIPPO! KIPPO 4 THE GAMERS,5,0,1.0.25,2021-01-11 06:48:31,,
gp:AOqpTOF49y3IsmRl016oJq_bD2ib4IKNdUeCNuvrKo3aPFr77f0hqLc-wVNZObdKf4kaR4ZJlD0w5ahxW-0C2w,Ryan Blake,https://play-lh.googleusercontent.com/a-/AOh14Gg2luwAZ7GowZ_V2j8CX4mRnilgXAwHWQIw2ar9Og,"Enable signing up for an account using a VoiP number or e-mail. I don't pay for a cellphone plan in Canada, as I want to get screwed and have my wallet gouged by pretty gamer girls, not by Canadian Telecomms. Make your app not utterly useless and I will update my review.",1,0,1.0.25,2021-01-11 01:53:02,,
gp:AOqpTOHKmEmqpMknXnDXRs0i-4eWbqseqR0hMBNn1L14PJ434GY0frvx1DOHH61dzDu7XbOv7k-AXAs6CrwjRA,Kevin Velasco,https://play-lh.googleusercontent.com/a-/AOh14GiUWFq3tJTsk0zv2_niXxWWnDSjOslWnRj4_qbmeQ,I love the design of your app and all the intricate little things you have for it thank you.,5,0,1.0.25,2021-01-10 23:23:34,,
gp:AOqpTOFDHtXnvUrsJv-HZLrs5T0ggC6N77fgR1jb-VpmxqDp5peCwe7aAOJpkN4eLdg1nD1dBnQuk5OKWlOcPw,Glasera,https://play-lh.googleusercontent.com/a-/AOh14GiZyURlDPbbJ7hpot7wJ6L2cvDUFS0iitcqJhnUeg,App won't even launch. I press the Kippo Icon on my home and it launches to a screen that say Kippo. Thats it!,1,0,1.1.1,2021-01-10 21:40:12,,
gp:AOqpTOEOZQBL2_MqAYlhQ2o4OGKSmeQNFuf4iMuATbs85zCH2-qIn4rD-4tv023Fv5QVZFZ48kbFK5IexMiLRw,Skylar Gill,https://play-lh.googleusercontent.com/-34blOLNSbgI/AAAAAAAAAAI/AAAAAAAAAAA/AMZuucmCj7gfZ6jLVjbBvh8hVDwAfDY0cA/photo.jpg,this feels cooler than most dating apps. I wonder if they’re going to expand into other areas through gaming?,5,0,1.0.25,2021-01-10 21:29:10,,
gp:AOqpTOGPzV6ODqL5KnOT0vaX3kUKDICbGAFV3pDWlwekfHUx0jqwCderqLeaA921kgAZWMGzZXkkdeOwDaPdEg,Ariel Riley,https://play-lh.googleusercontent.com/-hiWd7scY9Ho/AAAAAAAAAAI/AAAAAAAAAAA/AMZuucnzg0MvyPDz7a2ulBwWV3gkWgx-wg/photo.jpg,Experience is good,5,0,1.0.25,2021-01-10 15:55:24,,
gp:AOqpTOHPRGA-x5GPEaxNsjQmcrjlSMfOcGkOvyyVS150IlBnZVzKFN-K8zmy2mJ39CKCb71uOw_yqJOvQ74bYA,Hayden Morrow,https://play-lh.googleusercontent.com/-uFXr3DNi1II/AAAAAAAAAAI/AAAAAAAAAAA/AMZuuclCHKROlVvtGyaef96rB4valOMEkg/photo.jpg,Outstanding!!!!,5,0,1.0.17,2021-01-09 18:29:47,,
gp:AOqpTOHwF9l1zoYFo3gUNMvzqD8FyT74Jgs4oqPpqTz2QxtkDkjX9DZ1brUKG-sV2xajip9ECcz-2EB0hjzKpw,Maria Horne,https://play-lh.googleusercontent.com/-vFuIlkLeFu4/AAAAAAAAAAI/AAAAAAAAAAA/AMZuucmmQoeUv4btRjYXbLFBNL2jMv3NJw/photo.jpg,It is very nice. I recommend to all to install this app,5,0,1.0.25,2021-01-09 13:30:20,,
gp:AOqpTOF2a1UHdQTl6pJygUlq9kLt_-wzRQNYoKh7v9bRkRfqzpLa4TevpOTSz2r65VwuxGaPKEWqP8foPgeyyg,Rachel Lee,https://play-lh.googleusercontent.com/-Emi8s9S6TQc/AAAAAAAAAAI/AAAAAAAAAAA/AMZuuckZnY9bTpu5oq8CDmAjT-1STAOFSA/photo.jpg,Very efficient!!,5,0,1.0.17,2021-01-09 03:27:04,,
gp:AOqpTOH7kKHU_JHbAXni4CeEb_YWpPR6MTJBgZxOCKV3v4Q3VX3DJ__5mIqQy6K76jxo0guXhezZMfAsqjkHYQ,Patrick Porter,https://play-lh.googleusercontent.com/-f4psjdJY6fc/AAAAAAAAAAI/AAAAAAAAAAA/AMZuucmv8TnTqllglw1NOGGatVfumlmGTQ/photo.jpg,Very good no complaints,5,0,1.0.25,2021-01-09 02:23:53,,
gp:AOqpTOEGDOSXi5aavKMz6gb-FCre2NgcBs27_OFDlFXz9FIGhqgWNG7ZihAQ9H0KjarjMc-8m89bdOHVkUyi-g,Rionnos Games,https://play-lh.googleusercontent.com/-pXrsD2s7B24/AAAAAAAAAAI/AAAAAAAAAAA/AMZuucnhUZ_chdZm-9q0gD9t1Tt_yaNhRw/photo.jpg,"I like the layout, ease of use and options for profiles.",4,0,1.0.25,2021-01-08 21:19:07,,
gp:AOqpTOE44y8R0AT8EbVLDEyR23OVctOT_73WINkOChDqBWqdn__vUSGkugmxF3yI3zcbYJDz6KPZYUgIf4-8pQ,Micah Copeland,https://play-lh.googleusercontent.com/-xQ12fKJn03U/AAAAAAAAAAI/AAAAAAAAAAA/AMZuucnWsODKN-yf9ILA6Jeol4-7-_nHnQ/photo.jpg,"Amazing job, thanks",5,0,1.0.25,2021-01-08 20:20:57,,
gp:AOqpTOEmiMmbws8tiybZlrSw-ES-wo7ftETPNNf-eRnN83V8RGg4tGdAdgm7_izMENseTfAiSiSJO7JaHxx5Ng,Wild Dragon,https://play-lh.googleusercontent.com/a-/AOh14GhmWJQqgHh9k-hxCmbV0aGTbzkwPF0idJvNCejGZA,"Like the general format a lot, saves me the trouble of looking for someone nerdy who matches the other things I'm looking for. Odd that adding a Bio is a card you need to add and not something intrinsic to every account.",4,10,1.1.1,2021-01-08 12:46:07,,
gp:AOqpTOEVG1D-fv7bkdMsq0-F4CsuLnMbfQdXwbStHrXWvi6OSi5Hyb-jAxew-MoE_WvATYPAonYZSG0dHWTbOQ,Emma Bennett,https://play-lh.googleusercontent.com/a-/AOh14Gg3GHlvQDJR_j1rp2QivnJqa9lAtZHsq_6A5rah,Good app thank you,5,0,1.0.18,2021-01-08 11:21:52,,
gp:AOqpTOFdgac3rksNfV5G8mbFrCEM7AczgcO1ZJ5r0zmp8pSZ39ZrYw0Jc95fxsvpanh1_1oMNjhG9o8jesrH9g,allarry4,https://play-lh.googleusercontent.com/a-/AOh14Giad5-6LXGwVMOZ1uDvj1R-jeZTWzO_39sIx9BwSw,I says I need an internet connection. I was on a STRONG internet connection yet still had the error. :(,1,0,,2021-01-08 03:20:57,,
gp:AOqpTOGXRG0LnK4Xh-VYu0WaBuKhCRhHaTH7A7EaJBce_Hfa3p7AU50Pf9HVc9w8XDYnczC8l_6BxNVTCaiX0w,Colton Nichols,https://play-lh.googleusercontent.com/-PZDBG2LA5jU/AAAAAAAAAAI/AAAAAAAAAAA/AMZuuclz-XAVrUnWA7WEdMQN5Qac5WbtyA/photo.jpg,Excelent app!!,5,0,1.0.25,2021-01-08 02:26:54,,
gp:AOqpTOHg0oKqYQ4sGW9KUKXETsPGJQomFP6vZYuJQVbVyyqpltyxaBCKNeOQ_qgd6YbtyJh2yb1Bz3nnD42tiw,Harrison Tyson,https://play-lh.googleusercontent.com/-Pu3wWmbr9FU/AAAAAAAAAAI/AAAAAAAAAAA/AMZuucnmYhDQq2COw0NOowsa-OMVJdcCMA/photo.jpg,It is perfect,5,0,1.0.18,2021-01-07 15:32:31,,
gp:AOqpTOESgX9FjX5BL7s_UUANZrDnDij_Z3TQLOESxdaUsIJCn1qny4SHD8xn9Sx7FqAsV-226VZ7dKSBPu2mCw,bncsprite1,https://play-lh.googleusercontent.com/-upVu1MhzWZ4/AAAAAAAAAAI/AAAAAAAAAAA/AMZuuclqfqVevSoi43TZiaLeiG4PXNaNQg/photo.jpg,I contacted support with no response back after a week. It keeps tell me to expand my search area. I haven't had any matches.,1,1,1.0.25,2021-01-07 10:11:30,,
gp:AOqpTOFLzd6Tt-6xjT4JUnKf1CIqqhljxdUGB4V-t02FzY6IHSbvHL5kt3m6QFwtL1cc8bL_NYxnDjVoy4r6rA,Eli Atkinson,https://play-lh.googleusercontent.com/a-/AOh14GgycxDDMy2Unm4xDI7LtYsBt0kLn1QqrRPzHKqx,Very easy to use and reliable,5,0,1.0.17,2021-01-07 07:19:31,,
gp:AOqpTOHagjx0YsS3MqAsE0RzAdK1sANZRJNhkOKnobXwb-X3_Q7pbbsBp6AOcCDqxvAdLGHErYwovoYXwLol6g,Steven Belcher,https://play-lh.googleusercontent.com/a-/AOh14Gj7c-Z7Wz-xhHGufoazXP-Swxe6oArrZD0unUSxbQ,Only one DM per day without paying? Yeah no.,1,0,,2021-01-07 02:56:38,,
gp:AOqpTOGl9a3qezLOqVXJ_u0EiSFYO0twAWdTdTsIpHWnP_5K0ae5Jqlq6ynYbI9_YLSd8rPbDExeFH5MuyCwOQ,Pedro Owens,https://play-lh.googleusercontent.com/-wKmAbtsuJrA/AAAAAAAAAAI/AAAAAAAAAAA/AMZuuclqxAPRaLgXxBCAlnq2vsnWj2AFcg/photo.jpg,Overall i love this app.,5,0,1.0.25,2021-01-06 23:14:32,,
gp:AOqpTOEPuzfKyaUh-pKgoBQv4GD6rT_kPROiaM5reWd8frO8kTCSGkWBkX4dTjJqpTWlInrLE8Xhp5S8fHzZQA,Carly Watson,https://play-lh.googleusercontent.com/-NYiy_dHYGGs/AAAAAAAAAAI/AAAAAAAAAAA/AMZuucnr6YJTieLR66AqTBz9Zxq18SGK0A/photo.jpg,Good to use,5,0,1.0.23,2021-01-06 19:11:38,,
gp:AOqpTOE4eRVKlnvAxWE_w5E2w_Wq1E9QiMm2y3dt1jOynQ5f3VxwTCzHBalu1YzX1cd-7Ta-w7kwGdg1c2FpfQ,Shawn Burch,https://play-lh.googleusercontent.com/-zlZAhZtkfLg/AAAAAAAAAAI/AAAAAAAAAAA/AMZuuclK0ejQPC4h3Kxz7EcPZ2dsRoSZsA/photo.jpg,Simple and straightforward.,5,0,1.0.17,2021-01-06 14:59:45,,
gp:AOqpTOHwLmwHopJcocIwb3N2YTEzNsE2q9rE9P_YwnK8RqIkpleXoNY3wigCTgC8mU8WVs7N6einC2eyokXL7Q,Liliana Melton,https://play-lh.googleusercontent.com/-aNJK6HbbJCU/AAAAAAAAAAI/AAAAAAAAAAA/AMZuucnRCP0si9H8m1ZfFEKn7KQunY_mgw/photo.jpg,"very satisfying, i loved.",5,0,1.0.18,2021-01-06 09:03:48,,
gp:AOqpTOHid1YeNtsMzyoAX_iNlHJrCrI5su1DjmKWE9kNx6LxpTnsB2Of1KQJ6f6ObLvkURdFfy3RN2dBh0nchw,Tucker Morse,https://play-lh.googleusercontent.com/-ZMNoz7hIHUk/AAAAAAAAAAI/AAAAAAAAAAA/AMZuucnaytckBO1U4PBuxPayTLHxm1VYPQ/photo.jpg,It is a good app.,5,0,1.0.17,2021-01-06 02:06:26,,
gp:AOqpTOEreqb8w0qb8LwDOCOYWg2z6gMAoy_asgUbYRc-6CJh850W7IuPoYiOyx5ZMEjz0ZCfbXGj6tqGOa_vJQ,Michael Langston,https://play-lh.googleusercontent.com/a-/AOh14GhaL1OIjcBHIRbq4Ph-owjQeGEXYeTiyaGGWeuv,App keeps crashing and not being able to restart until I reinstall it. Lasted long enough for me to make my account and then once I started actually using it it just immediately crashes every time..,1,0,,2021-01-05 20:25:10,,
gp:AOqpTOGREP1QUA1Ke3ElFuwVQgpLExoS86z0f5rjg1n5IJTIy-liehJbd01sAZjntpfgc1IlFfY6XmY2TohDCw,Jude Gill,https://play-lh.googleusercontent.com/-6E_hQdA6P6I/AAAAAAAAAAI/AAAAAAAAAAA/AMZuuckSQHXOI6CrM_lxOs1tCbxI-D4R1g/photo.jpg,Helped very much,5,0,1.0.17,2021-01-05 18:01:50,,
gp:AOqpTOG-B5R5IGvR8pyeXq1vT9qgMn4VnqmGiZvoWWzNvKszEOMUIZQDjexImZo0aQKLZtB3EORkF1sscq_Wyw,Austin Booth,https://play-lh.googleusercontent.com/a-/AOh14GgrQX7sPzdlASMo9j4rwxbVEogqoNAUU07giA8l,Very very nice app,5,0,1.0.25,2021-01-05 15:03:54,,
gp:AOqpTOGN3chytvdGj1Fun2bv8ZNfQXGNdURnUgtOkVLlbZ-3gTqf23t1q8Qc5y1fh1H0_ZsWbB9mUdUKdn7VLA,Eduardo Hardin,https://play-lh.googleusercontent.com/a-/AOh14GjMyLCsA5evE2cjftEGPKljJCypAT_TtGyCrRs,It just helps me alot,5,0,1.0.25,2021-01-05 13:03:17,,
gp:AOqpTOGqHj7icuFmfc34eghAmKFF62HWxA8VABCsIHFaKDcJbk9yN8L3NwDYl6nrOC_4HmxDgEtyAYwqW2xOsw,Samuel Hamilton,https://play-lh.googleusercontent.com/-cW1pTwA9FsU/AAAAAAAAAAI/AAAAAAAAAAA/AMZuuckUK3qlFF07ZDm_rmNZV0QIpizoNw/photo.jpg,anyone complaining about the price hasn’t used other dating apps you’re getting more for costing less,5,1,1.0.17,2021-01-05 06:05:24,,
gp:AOqpTOHCOnXsSCXzsULgXwdZMet3oMNd-qKosS8MMPk1hsdgFgRSmGB9rN2EWLmccT4BRE4cj4zzlbLIXauB0w,Mariana Bennett,https://play-lh.googleusercontent.com/-_nc4qg0CUnk/AAAAAAAAAAI/AAAAAAAAAAA/AMZuuclVv7RmGxmd3ByOHeQ5EbtFUn1dpg/photo.jpg,This is super app.,5,0,1.0.25,2021-01-04 21:17:58,,
gp:AOqpTOEikFfy2PZznFLybRcLT-tYM7sXwNzIwDXbL9JmevDWkaTSHne_XfWJY6u15dgcvvnr8r7xbQfXdZ44Ww,Justin Contreras,https://play-lh.googleusercontent.com/a-/AOh14GgHTLNOmmLHgPfes5iqw-Y5W0jSWZoTxXjaKHsxjHg,"So far it's alright. Got the upgraded version so I can swipe to my heart's content. I have gone through the entire user base within 5 years of my age within 75 miles, but haven't matched with anyone yet. The cost is much better than other apps imo. I have higher hopes that this will result in something. The only thing I would like is the ability to review my likes so I can direct message folks that I didn't initially do so with. I definitely say give it a shot and help build the userbase.",4,11,1.0.25,2021-01-04 20:03:16,,
gp:AOqpTOGjYxJHBYTyMEh5UcbIvZjvhPv72todZJQ7UQM1mx-G3OU0CO0TXs9LIUeDC0HBhVDwm4Q86xQi3Ho18w,Krishna Teja Salimeda,https://play-lh.googleusercontent.com/a-/AOh14GjrW0fLHZuLdlpNL3jKFY5vYkrVrXA7H40FR-CPT8o,Best dating app ever! As a gamer love kippo dating app.,5,0,1.0.25,2021-01-04 17:22:18,,
gp:AOqpTOHGblVyCDKJ48h8bPcichYPFFrixxEvIvmuDwBCZ_idEk0yGtEiotH7lTFLP3tTrg3Ebv-vV86Hnf_ABw,Cody Montoya,https://play-lh.googleusercontent.com/-C2G1bACEHiA/AAAAAAAAAAI/AAAAAAAAAAA/AMZuuck8JKbYbdaXu_RuXRBOaN5--N10-g/photo.jpg,Good. thank you.,5,0,1.0.18,2021-01-04 17:04:44,,
gp:AOqpTOGmhYLn9DOKNWfi2hlKLAFHRP1VLiJ1OzArr-UuWM1DjWZuzAchyFPgt_IQaOXyuqru3Jq6dZKGNCCeRg,Isabella Adams,https://play-lh.googleusercontent.com/-TkAWJZ1k9c4/AAAAAAAAAAI/AAAAAAAAAAA/AMZuuckAL_TZwZt-x2kcls7vCNhToMfmSg/photo.jpg,Superb performance l like it,5,0,1.0.25,2021-01-04 12:10:59,,
gp:AOqpTOFlxrulMCG94Il9TzzIDOhAJM_5d7rH_Za43gp9EVEHQ4wSmbof13miKJK2xJQCbZ9bBuoc-H47Kq4KAA,Adrianna Reed,https://play-lh.googleusercontent.com/a-/AOh14Gih1kkq_g4Ah_IHxiDh5RCiY_miNrMShawiMBeN,awesome aap,5,0,1.0.18,2021-01-04 11:59:35,,
gp:AOqpTOGlxUtNVCmS7o5A8nXZ1ZHMEtPXSsX3OuDX92RhWatLr0OdzDIJNcczp-3Croy775fznN6_QuZCaFWGsQ,Joshua Marshall,https://play-lh.googleusercontent.com/a-/AOh14Gg7IOl1bk8zAY9w7vgXxUwUMNnbJLMiAJBQ7ekLoA,Just started and so far so amazing. Very easy to create your profile with its unique and creative design. This is an app that should be advertised on Twitch amongst other gaming outlets. Need to see more people on here.,5,3,1.0.25,2021-01-04 10:49:38,,
gp:AOqpTOHTr5j3r2AjlyrseSNWiaXvu1JniPdhs197xhq9QWbjv9kdRvmAAkHf7ktNDHnS0PJ3xgGwL6lhO5Z9ZQ,Tasywolf,https://play-lh.googleusercontent.com/a-/AOh14GizkjoJgtyyR2NAp62G8R_m9Y1wYQDogPgao2MCRQ,So for in my experience is a three. I do really like how they do the profile my only issue is that out of 30 people they were all 2k miles away for me. I'll try the app for a few more days if I only get people so far away I'm going to have to just drop this app.,3,0,1.0.25,2021-01-04 07:18:44,,
gp:AOqpTOGR_-K5vsNXkXaUIvmYzj6ZdeS233tEgsX6EaMCTIE1WA__tZzIv3dsCEV01uZAkFRwExoYssMIr6PohA,Addison Todd,https://play-lh.googleusercontent.com/-l-OKCdhBaoM/AAAAAAAAAAI/AAAAAAAAAAA/AMZuucmN8RLL4WQ1gn_LKX-F4wrhillAkg/photo.jpg,Good experience,5,0,1.0.18,2021-01-04 04:59:46,,
gp:AOqpTOElf3pgbcxBOpK1xo3mz7LQ7tstFp5cljeBnmoXlHok75MEbOmZ_vYCrhQtRc67nuJ43Wy1qXgl84-8aw,Troy Hale,https://play-lh.googleusercontent.com/-FBauMNjDaoU/AAAAAAAAAAI/AAAAAAAAAAA/AMZuuck__SoTU7IU9OKWzXaYqL-kEEK5lQ/photo.jpg,It is very very useful,5,0,1.0.25,2021-01-03 20:14:56,,
gp:AOqpTOHAxoBdaTht3E3gEObn3kqfexKIchWPQAnDWkhA1zx3dDRoBsf4u7PiCBgUm-fYsU867LPgXZNMbn1l9Q,Hannah Estes,https://play-lh.googleusercontent.com/a-/AOh14GiMP6v77rpJCYCNXsatIAPBNiiOAMvxqskYkPfA,Im honestly impressed hope they keep it up,5,0,1.0.17,2021-01-03 15:35:12,,
gp:AOqpTOH44dExWvgW5BO-BhXELA8YYl9UfneGEGuEo4F9Tt9z8BR6Mr3wKRAcKYfpb4aFTx86KDwCOHJfC4qZSQ,Preston Dorsey,https://play-lh.googleusercontent.com/-v9G-mEbZDxY/AAAAAAAAAAI/AAAAAAAAAAA/AMZuuck8eLIEf2gI-Xah9aGeJxH-wF_eVw/photo.jpg,Super Super App,5,0,1.0.25,2021-01-03 15:12:38,,
gp:AOqpTOFvFQ5mlR23fVt82GMoE0TRg7vz4GB2KMdj-_s4HqeE4JHJMcaZxtZhUnH_HuWsFgpZYR23Un9i3cLtcQ,Stella Hicks,https://play-lh.googleusercontent.com/-n1AhS83pjAM/AAAAAAAAAAI/AAAAAAAAAAA/AMZuuclxemAjRgdZwSjYrzsCcCng2ibllw/photo.jpg,Great App thanks,5,0,1.0.18,2021-01-03 11:13:07,,
gp:AOqpTOFktksqdH-INFpiXM6wX9hdXBtIWLk9LBv6ucwJKJr_RP3oki8N6fT7jcMZQloZc6Xq66Z0t72kTnzgkA,Leonardo Rovers,https://play-lh.googleusercontent.com/-OVVCsEMN-4Q/AAAAAAAAAAI/AAAAAAAAAAA/AMZuucml2LGLh3xhQBd-gP1wh_M6FdAObA/photo.jpg,"I keep getting matched with people across the border, I'm in British Columbia but I keep getting matched with people from Washington. Due to covid that makes things SUPER inconvenient.",1,0,1.0.25,2021-01-03 08:42:19,,
gp:AOqpTOFghzgDLSWJlIqQLsRuXkWxnStxhQWCXOvYfDzH3XgnU4o4ZrxrlUo9Sya4ncEiklsVFDATQono0dH9WQ,Maya Bradford,https://play-lh.googleusercontent.com/-CAKkW92uKzE/AAAAAAAAAAI/AAAAAAAAAAA/AMZuucmN0BMpE8IKanW1Q77k4wTaAt0H-A/photo.jpg,Very nice app thanks,5,0,1.0.25,2021-01-02 19:27:04,,
gp:AOqpTOHbyH8y02wCv5khAW9VZLueuxkhFdwgqlgDZ4xX79EpJHFZYL2UfmttxsMRpg5RHXyBo4hBEKqiV9CBgA,Vanessa Hammond,https://play-lh.googleusercontent.com/-7mWNc4RmL2A/AAAAAAAAAAI/AAAAAAAAAAA/AMZuucnTJoi49YMpRBmo4KgJmGjPHOh4FQ/photo.jpg,Nice and excellent,5,0,1.0.17,2021-01-02 15:34:19,,
gp:AOqpTOEhTX8Z_nJjBr8mqIXyH1nnPC5kVDy2eSwh_ocSwnMqAZfRLNYzIb-DvrmrrRqb02FoTMB7UueS2a7jZQ,Jonah Leblanc,https://play-lh.googleusercontent.com/a-/AOh14GjeZQb_JDaZBV27y_ykRhMfxepGa4RgpQZd2VE,Keep up the good work,5,0,1.0.18,2021-01-02 11:30:19,,
gp:AOqpTOFHhzvefqaNXbZuh6GVT8ggtttuvTxUzUneZ6uC4uGzR3nbeLBByfP6YNg3njs_B5vXWdyEbrJnQeKiTA,Mark Conrad,https://play-lh.googleusercontent.com/-7yV0cmZLHk8/AAAAAAAAAAI/AAAAAAAAAAA/AMZuuclPce02vfjqzpAQYAMA-cwgtsAwdw/photo.jpg,I like it thank you,5,0,1.0.17,2021-01-02 06:41:58,,
gp:AOqpTOHirmL4PQaBMKs3DXU8schz0z9JwQl3U95RRtpYA2ZZ6MX7rFmMeBdWEPNIMYW3Lp9u0L2sJQ9WjneEkg,Vivian Simon,https://play-lh.googleusercontent.com/-pGClid64pDI/AAAAAAAAAAI/AAAAAAAAAAA/AMZuuclWnTeMuqMv17KKvpbacAHuciq3pg/photo.jpg,100 percent,5,0,1.0.23,2021-01-01 23:27:38,,
gp:AOqpTOGDqH9OvRuimBEfEfs3ifl5yOvgDk2Y31yzredKh85mqZZZSZ2pX6DHNlLwoVK3G6lfBEmqFl1feln5aw,Dominic Rose,https://play-lh.googleusercontent.com/-j0cGg_xiI2I/AAAAAAAAAAI/AAAAAAAAAAA/AMZuuckRpcJ9JjFngP8WwidGDLHFc_mA1g/photo.jpg,Easy to use,5,0,1.0.17,2021-01-01 17:29:05,,
gp:AOqpTOFWn6tVr2c0YXPlvkaAGx2ikCKDYeAQ5CrlNbgcsBjg-sQWz_NjQR_llEEICYYqKY5xIuKHPEO7Bh9toA,Allie Bates,https://play-lh.googleusercontent.com/-yDy9BXmaEpA/AAAAAAAAAAI/AAAAAAAAAAA/AMZuucmb6Il8hkUrLJahEqa0eAzPRL4sNQ/photo.jpg,VERY useful!,5,0,1.0.17,2021-01-01 14:33:32,,
gp:AOqpTOE7gIeNYDInDAIoLcxor11Y7osu6JFD8Vrllv0DN7ATpbOPyfeKmRT3U2uH0p8V8RLJtQtzVLBt-P71VQ,Lydia Perez,https://play-lh.googleusercontent.com/-i5Uj95qM02M/AAAAAAAAAAI/AAAAAAAAAAA/AMZuucnylmZFEz9fVAm8IzZoknqalatnBw/photo.jpg,Great app to have on hand,5,0,1.0.17,2021-01-01 10:31:27,,
gp:AOqpTOFnNopoLl4Ilxr-m6kin2nYuxFIo_iPrdBqHQ2Blyx3HoxqRgfvOHJURv0VTgCzr40gnDPNwtHwUXpU-g,Mark Moody,https://play-lh.googleusercontent.com/a-/AOh14GhF7laCXYJIQLPWmEN4uYTIGtSriUUOhPupYMbU,Finally its available on Android!! I’ve waited for so long,5,0,1.0.17,2021-01-01 04:30:44,,
gp:AOqpTOFgOV_OApdPZxaOZw59wuIxEQ6L2yxz2urqKM71VeRHbE4BLBxJycxVGaxSppHKhgBefd5vGY3g6lQBeA,Ariana Sosa,https://play-lh.googleusercontent.com/-VcDhg_-iluU/AAAAAAAAAAI/AAAAAAAAAAA/AMZuuclNzECVxmcmr9ScAmKxrkfWrYhnMA/photo.jpg,Good useful better than others.,5,0,1.0.17,2020-12-31 22:28:46,,
gp:AOqpTOF3HEww2lKgWA15WBoa-MqCgoOfUJkTCypOxYd62ZF7zkqBFsn2fXyKcRN0HUQraRs93ePuOi-AMY0DBw,Erik Burns,https://play-lh.googleusercontent.com/-7pdutu0K2OY/AAAAAAAAAAI/AAAAAAAAAAA/AMZuuckhIKW_rTy8bAnW_-ngq6GIhSO0iw/photo.jpg,Very nice job,5,0,1.0.18,2020-12-31 15:43:42,,
gp:AOqpTOGcDgMsW7ZY-W2uNe-gjnLLA1ksoFmghZ5KDnUEJiq79iLJRx3XpXfHPLWK5irSw9dIsdfttAHBHwGUpw,Rebecca Joyner,https://play-lh.googleusercontent.com/--rJZw2sZlJA/AAAAAAAAAAI/AAAAAAAAAAA/AMZuuckzbs71HFUqomRtPEpHVFXYtMJNow/photo.jpg,Very good Best I can say,5,0,1.0.18,2020-12-31 13:29:48,,
gp:AOqpTOHq80Co_1x5wWqVAv8Pz706ob15NKroj7Pp3BGSLZHXuKB9UWJMbbVX9ZX-Che1qpD2A8m6Xk2CP4DN_Q,Catherine Armstrong,https://play-lh.googleusercontent.com/-XkRVIm2pWBM/AAAAAAAAAAI/AAAAAAAAAAA/AMZuucm8oVFKCsl0lq2XzXa-WeBa0Ty4Cg/photo.jpg,"Sleek app, surprised at how well it’s made I haven't really seen animations like these in a dating app",5,0,1.0.17,2020-12-30 21:20:03,,
gp:AOqpTOHqmoKmVdHCqrioZ77WTp_gc0wycoNWCVajcx-UhBg3-jlSWYurA9UlLTPPS8bQtd8oKaFf6iRNqvmDrQ,Jaxon Lott,https://play-lh.googleusercontent.com/-8uz6jK_iXP0/AAAAAAAAAAI/AAAAAAAAAAA/AMZuucnV5C_lzbcDTkW2jtiFeZbqiLZcIg/photo.jpg,This is very good apps.,5,0,1.0.18,2020-12-30 12:25:23,,
gp:AOqpTOFmdeL70ZVEmE7yBV-a-yzaOCsea-XT6MgTo8kMsfES0Ym_StwCZ0nmnOuSaVELd_xZYiu7aBVncolijQ,James Jewell,https://play-lh.googleusercontent.com/a-/AOh14Gjsq5sLeZxvRQfeycBWv8ClqM5b_3mvCr-4UYLm0w,Cant even make an account. Will not allow to add images to continue process. All permissions allowed on a galaxy s10. Hoped to try it out.,1,0,1.0.25,2020-12-30 08:55:48,,
gp:AOqpTOE5mcFckh3kl56T_XjUBnMXot1JtBHDp9I7YJytElP02p76SgFaJUsgcX7-_vwxZsg_g_kn7jQXowZIIA,Nicolas Mason,https://play-lh.googleusercontent.com/-7C_dso-gs2M/AAAAAAAAAAI/AAAAAAAAAAA/AMZuuclspfFlqjXFQdX8P0-R1ZM6oYzYCA/photo.jpg,It's pretty good,5,0,1.0.17,2020-12-30 08:50:35,,
gp:AOqpTOFhcOuyeAiRrxLyE-3hzy4DwnxZn69RlfVepqm81PM22UWujBBi5MmP-rihS_10QcdooAxyo8xE_dPJ8g,Alejandro Sanchez,https://play-lh.googleusercontent.com/-EHp5FCfFNyM/AAAAAAAAAAI/AAAAAAAAAAA/AMZuucnK9eVO0gk6fBjPEExnCp_dVJ52_Q/photo.jpg,It is a very usefull app,5,0,1.0.25,2020-12-30 08:37:02,,
gp:AOqpTOF5AeYCq60xx5T89u-WlAX8MT2O1NorGWSyvj3oEbqVQhPkMoC2mTnpc6bY_5ZPhS2Q7dbStdhWchmegA,May Morillo,https://play-lh.googleusercontent.com/a-/AOh14GhdvPnj6XpOn6fiOgejmEPbp8T3VuDqs1ykzxkN,This app got me into main Hecarims. Nice and intuitive interface. Problems with notifications sometimes.,5,0,,2020-12-30 00:07:33,,
gp:AOqpTOE-ANtsqlffihaMQOGkqQywQcy95Li1cokzd1h5CAFvOJ0uAwd9mcdhO8aXQDUa7hhlQyNnnTZIFKD1zQ,Evan Williamson,https://play-lh.googleusercontent.com/a-/AOh14GiDGbI9BCIiJfRU3QhfrKPYPJZTREqVCw4YM971,That's very awesome and very helpful,5,0,1.0.25,2020-12-29 18:35:31,,
gp:AOqpTOFkl_Tp6S0tvV6GkKEYGImJmVrS1OUUD5FLWgbhWABDK1uu9vmlim0Amb68M5JnjKqLf5KxIpaPr4RdjA,Calvin Hunter,https://play-lh.googleusercontent.com/-ClwDIPpzVC4/AAAAAAAAAAI/AAAAAAAAAAA/AMZuucnGD9oZd2NDsiog4_S-DeQab_mepA/photo.jpg,It's really very impressive to everybody,5,0,1.0.18,2020-12-29 16:11:59,,
