reviewId,userName,userImage,content,score,thumbsUpCount,reviewCreatedVersion,at,replyContent,repliedAt
gp:AOqpTOErlLAEYCNV2TRVusw1BFz8sl74WtvqcuI7ATR-MYaWr4YgZYySYoYMy2L42yx2myM5-v9VuXm9CXSwvA,epic ninja sensei dinosaur puppet,https://play-lh.googleusercontent.com/a-/AOh14GiTm5W-1UdEXpyVWVZqnBYyGdkSjMALPehC3B-r,Pretty good only have 2 problems so far 1. Swiping right and saying no shouldnt be counted aginst you 2. Not enough swipes for a day this is my first day and i used it all in 10 mims would be nice for free unlimited swipes or having swipe right not go aginst you Something i really like is there are real people on this app they all look geuinie. Also even if you dont play games you could probally find someone on here Location and age filiter are really good.,4,0,1.0.23,2020-12-01 21:13:21,,
gp:AOqpTOHUv6akivOXWehVWSVO_GCYfOHe_M5YDtzaszm8AJsqgVT9MPRxd4dhiO-l2eN0NR6ht0yVUlsI5iquDQ,Kyla Davis,https://play-lh.googleusercontent.com/a-/AOh14GheXTCDlxfhIKnY1khr4Aw2ux-6vQ5sNheRIxpR,"The app itself isn't badly constructed, but no one in it talks. It's a lot like Tinder in it's set up.",4,0,,2020-11-30 19:42:54,,
gp:AOqpTOFvpmLHMsNM6hLb5QAdYA9Jes0L4bfp2evdwSXsyKfSo3_FSfx_Af2kNbCP4RWS8pDRGtvgb_dzFt9LPA,Nicholas Godena,https://play-lh.googleusercontent.com/a-/AOh14GgIMeQ20GqZpBhTDK8jZ-D-djykDxY8Ox3r_9EG2Q,"First impressions: Original, Fun, Simple to use UI, diffrent and made for Gamers and seeking for Gamers. No memes in pictures, Not a joke like tinder and messages can be sent,",4,0,1.0.23,2020-11-30 12:45:42,,
gp:AOqpTOE-4csU1sQSnDi4b0fUt1c0I3RZn_iImjhoq1Qgvf-OiXv8zgRTiAYtm7LZ6s_4B6B6-ocJhD1mpmhBwA,nab1231,https://play-lh.googleusercontent.com/a-/AOh14GiRhTZx3jmPfMK78LYvbZTh0OrPIzROg89neWOJ,Had the app for about a month. First off not many people on it in Tennessee and second off i messaged some and liked many and nothing. Not worth it,1,2,,2020-11-29 13:44:15,Hey! Kippo is still a pretty new app but the community is growing quickly. Most of our users are in major cities in the US so it might be harder to find people in Tennessee. We allow you to search any distance though so that you can match with people anywhere.,2020-12-04 22:33:51
gp:AOqpTOEtsvLT0IKJ58e_DAWKfzPaSaN7FYDgznkeGSnAYBH7l67dmSOJ4-C4jSDOby7X66dhbl5eQ4XD8Urxxw,R Newbery,https://play-lh.googleusercontent.com/a-/AOh14GhoQOA0GQb4-GgEvQ-ACIJrYVmySiSHhRvAZrOn,"So, the messaging limitation sucks, unsure if there's one for responding to messages, and there is a severe need for people to all have bios, thats not hidden in a card, everyone gets s bio, whether they fill it is another story. Its gkt potential, abd its cheaper than other apps but I dont know if people actually check this one. We'll see.",3,6,1.0.23,2020-11-29 08:00:38,"Hey thanks so much for leaving a review! There is no limitation on Messaging. For the free version, you get to send one Direct Message per day but once you matched, you can send as many messages back and forth as you want. requiring bios just make ppl spam their instagrams so we created our card deck system.",2020-12-04 22:35:47
gp:AOqpTOEzsf-AplKG4AUWPzyN4Gzy920nv30B5GinMgJWNVdWWfGX-_lSwdxz3hxHqdNl8HKL17bwevJSEx2NXQ,Andrew Jimenez,https://play-lh.googleusercontent.com/-4II1KqV3BS8/AAAAAAAAAAI/AAAAAAAAArw/AMZuucmrA53bwZj6Q4bT5uF1BaZGHbvMGQ/photo.jpg,"Genuinely one of the better looking dating apps out there. The profile customization is really fun too. I hope more customization is added, like being able to add favorite movies/shows/anime/books ect...The only thing holding it back is lack of users and the strictness of swipes (why am I losing swipes for swiping left??). Despite this, it's worth making and keeping an account up, with the hope that the user base grows. Edit: DM amount should be extended. Changing to 4 stars because of that.",4,16,1.0.22,2020-11-28 12:27:59,,
gp:AOqpTOEM-BLT8wKb67kH7ohCIEhU7PaTO0ye6i9XDcp7pCO6wCfSogevD5VSRo1jraPdGyfmISXeBtdn67TwMA,Jacob Phelps,https://play-lh.googleusercontent.com/a-/AOh14Gin00qvSQISt5-5BurPmc11_84RUFFUfQjjfVTsRQ,"I would give it a better rating, but it doesn't open. I tried giving it permissions for location and even storage, but it didn't work.",1,2,1.0.22,2020-11-27 05:42:12,Hey Jacob. Shoot me an email sup@kippoapp.com and we'll get the issue fixed for you!,2020-12-04 22:36:05
gp:AOqpTOF49xE0B5ZOtdZnLsn8HnqZO9sHGAhvvsHoJJyMChVP2LYGF8pUCoowTFOSbh1kcsnCyA68JWlyCeRtuA,C D,https://play-lh.googleusercontent.com/-A7GjcvwRITo/AAAAAAAAAAI/AAAAAAAAAAA/AMZuucnP5PWSaDQs40z8kNUrwauOJEEwYw/photo.jpg,I wanted to use this app. I have installed it 2 times. It will not open. This is garbage.,1,0,1.0.22,2020-11-26 06:25:59,Hey Jacob. Shoot me an email sup@kippoapp.com and we'll get the issue fixed for you!,2020-12-04 22:36:16
gp:AOqpTOH3Vu1_mP7uK18QypK4D-N8LxG-oDAqNOWamhfZQB_7uw8bKdeBoY5DpM-OgtJbh8NZRzCec6vbp24fxw,Stephani J,https://play-lh.googleusercontent.com/a-/AOh14Gjvs9ijl0HOGchb_1Rk0-Qo4gj6uvBDxPdDgwGUfQ,"Cant give a proper review since the app doesn't even open for me! :( a message pops up and says, 2 exceptions occurred. Help please !!",1,2,1.0.22,2020-11-24 22:43:49,Hey Jacob. Shoot me an email sup@kippoapp.com and we'll get the issue fixed for you!,2020-12-04 22:36:24
gp:AOqpTOHVO44fOqU6C0mK1ZbBsg6rV09CCvlMyM6LcU_tYN4ghAFlsGNmb1jjgXjFrU6oHrhRGe6OjcR2KucLyg,MikeMine2002,https://play-lh.googleusercontent.com/a-/AOh14Gg32p65csPDAjsRYdJtcVfdvrPuRwxQHDP2lr2irQ,It would be very helpful if you would allow me to dm people I'm interested in after I hit yes. And not make me miss the chance to dm if I like someone but am busy.,3,0,1.0.22,2020-11-24 16:01:52,,
gp:AOqpTOEQSMqryYF-aLw64kiOsRBw5I3X45Ofdabt1FbBuKQPAC4ziXzF3akTPKwuRt2i37GBq0XVzL8ewXjcWg,william h,https://play-lh.googleusercontent.com/-z4j4sxvrl8s/AAAAAAAAAAI/AAAAAAAAAAA/AMZuucnxFjcchgQ6w5MO6YeJeeOlGH9NYA/photo.jpg,STUPID APP AND NOBODY USES IT......,1,3,,2020-11-23 02:34:49,Hey. Sorry to hear that you are not enjoying Kippo. We are a new app but we've grown quickly to over 100k people using Kippo. Also everyone at the company uses Kippo daily too...,2020-12-04 22:37:48
gp:AOqpTOGZzo44gk8_lZ0Ivt3lHuvZLoiplRsnmcHrqKd2qs6bjT6VYJQDMkxxGnHOaht55-_7VyFyh3Mu-NB-wA,PenguinMP44,https://play-lh.googleusercontent.com/-rVQNM4IsSj0/AAAAAAAAAAI/AAAAAAAAAAA/AMZuuckMktuaHzzdHerWgYJsbayCNT2aoQ/photo.jpg,I can't open the app its just says 2 exceptions occurred?,2,0,1.0.22,2020-11-21 19:13:20,Hey! Shoot me an email sup@kippoapp.com and we'll get the issue fixed for you!,2020-12-04 22:41:51
gp:AOqpTOEImwadLElAq7tr2DX6bhPUw0d2z6GpXKezdUpbVNNVgNht4E3R8cRN8hiRIrtXliqK5gXq6LnInifLdg,Kat Deans,https://play-lh.googleusercontent.com/a-/AOh14GikVqIBtrRzesmAIGJxgaZQ-ZrVtlAX8xWfjyUTTw,This is honestly such a cool app; it's an amazing idea. Unfortunately it really only works well in more metropolitan areas where the nerd communities are much larger,4,2,1.0.21,2020-11-19 03:29:10,,
gp:AOqpTOF_HRnYjL07SRJ9ujZUl5ELo56hq2E5W-o8gZUBbqt3G9n1845bV6IIVn1oDLjKGOYFEPKpwzxuncfLHg,Caitlin Colbert,https://play-lh.googleusercontent.com/a-/AOh14GjsbaUtISARN6CdmE0v4wPtkMqcIgxOOEDbRY-iYH4,Lame. Dead no one near me. Always glitched,1,1,1.0.22,2020-11-18 23:26:54,,
gp:AOqpTOHu5hvaZUkHULd537FF3zDKzpaFSMd2HpEIEAM0T6WSyOm1_Rjlf_pdZ55QBe9NyVKE3nfEMX4nBkFZ7g,Chris Zimmitti,https://play-lh.googleusercontent.com/a-/AOh14GjXVykBauqQSfJf484OLaUFh-x3nIm1N1LsNHLc1g,Not enough people on the app just yet but you are mostly getting gamers so that's to be expected. Only problem I have with it is they have to update the games regularly for the cards.,3,0,1.0.22,2020-11-18 21:06:05,,
gp:AOqpTOELCEVdsqEwwKzy44kUYUC-CQCIqbTidE_MHsw-9rfb1r8fkZ4GNJI_eFtIcUXislgipjV_lZ2BkL5pDg,Lee Trinh,https://play-lh.googleusercontent.com/a-/AOh14Gh1wgx5OIjFVkYi-pAMw7wQn31Glk8HeIW71HG1WA,App doesn't work? The UX is so nice and seems nice! But nothing loads and it takes forever to.... I keep getting notifications but my app won't even open! I really do want to use it.,2,0,1.0.22,2020-11-18 09:26:35,Hey Lee. Shoot me an email sup@kippoapp.com and we'll get the issue fixed for you!,2020-12-04 22:41:33
gp:AOqpTOHiqa7BcZM495OOgGlGQSc7MXb5kOEKaPnsVgDViXqfMVmKngyvwwUSQvXGYZiTWaK0qO2QMOz47n7SFQ,Christopher Hardiman,https://play-lh.googleusercontent.com/-kJgC0Rsqm5Y/AAAAAAAAAAI/AAAAAAAAAAA/AMZuucm5MnBwyHnxged_Uqb8GYz__77k2g/photo.jpg,"It's a nice idea, but my problem is that once you go through all the profiles in an area that's it. No seeing a profile again that has been updated later.",2,3,1.0.21,2020-11-17 18:19:12,Hey Christopher. You will actually be able to see people from the past again! Our algorithm gives you second changes to match with or message people from before.,2020-12-04 22:39:15
gp:AOqpTOFJXe8vwZuUEOg6XfWNdDOSCKqssiAPWzlG7QwUx8sHWKd9SD_F3piX32ksJUJcoIu6RqVMSSTT1_aE7Q,Sean Johnson,https://play-lh.googleusercontent.com/-fSedFWs2iZQ/AAAAAAAAAAI/AAAAAAAAAAA/AMZuucnqNm48zRDAiLrmuxUrFQZGuIi2Xg/photo.jpg,"Unable to permanently delete account. As far as I know the only way to do so is through the app, and when I try I get an error message. Pretty fishy :/",1,4,1.0.21,2020-11-17 15:15:29,Hey Sean. Shoot me an email sup@kippoapp.com and we'll get the issue fixed for you!,2020-12-04 22:41:11
gp:AOqpTOFdcd9SmJqcQaSYIY9xBDzkheQBDu_QBcuzyg_yDkmeRafG1xkH4sGlDNG-2spRO51TW6c_8o5wfUMXhQ,Hambone02,https://play-lh.googleusercontent.com/a-/AOh14GjdQmCqlm8nUfP6-_6TOB66TytEeO5McMMcuuPWYg,When I request authentication code and put it in it always says the codes are wrong I'll even request multiple codes.,1,1,,2020-11-16 05:16:21,Hey! Shoot me an email sup@kippoapp.com and we'll get the issue fixed for you!,2020-12-04 22:41:19
gp:AOqpTOH90frEHsjItSNWHb0yQyOhUeISvp4yIMN4BJrxuyHzzw51XsrV9s_4nxPKNwv55__idvidj4nHn3F-Qg,Asa Morris,https://play-lh.googleusercontent.com/-fp8O-ZhQoAY/AAAAAAAAAAI/AAAAAAAAAAA/AMZuucm_fTmwJLE_FfuzPrZRU04shcTWuA/photo.jpg,Lotsa potential. can't copy text from other's messages tho? I'm not going to enter that music recommendation Spotify link manually lmao,4,0,1.0.18,2020-11-15 18:01:19,,
gp:AOqpTOH-iECUvebl1TmvgfpkhURYImfnJosUsjyR2vsWxHsIyHBn7ffAu944jDkoiCxgjeG2COfCjKLzezmh7w,Jason Geiger,https://play-lh.googleusercontent.com/a-/AOh14Giodf9XQ2E7Eb-pTe4IklEDVOGMbC5BfchlmOT-KA,"Preemptively rating this one star considering it only lets you see 30 profiles, most of the bios are pseudointellectual garbage like sign and the 4 letter personality type (just put an IQ test in there too, the science is the same), and I already know that like every other dating app this isn't going to work for losers like myself. I'm giving it a try, but typically these are money sinks for gullible men and ego inflators for women. Congrats on your success, rodents. Edit: doesn't work at all",1,1,1.0.18,2020-11-15 02:56:02,"Hey I know this is an app review but I'd like to give you some dating advice. If you go into dating with that attitude, I could have told you immediately that you were going to fail.",2020-12-04 22:40:41
gp:AOqpTOF1443W-49TjsOiMbiYyXWipqKtaq-QVNj6fi47K_9fqIKBOqX0Q5Yu0qRPIrwgc8-WpoaY_csTrIijrQ,Anthony Clemetson,https://play-lh.googleusercontent.com/-17iJof3GY_g/AAAAAAAAAAI/AAAAAAAAAAA/AMZuucnO4xxmwXxmAC6H5tFPaEWnpJcbaQ/photo.jpg,App crashed 2 days ago and still won't load up,1,2,1.0.21,2020-11-15 01:43:34,Hey Anthony. Shoot me an email sup@kippoapp.com and we'll get the issue fixed for you!,2020-12-04 22:42:11
gp:AOqpTOGqxAHLjoQApZYcrQJxeEl6z3Et0KZm4ZuHzc32De-nxW-7opdNFVh2F0sYRshe1oFGe-8M4S6ptN0RiQ,Elvis Sun,https://play-lh.googleusercontent.com/a-/AOh14GgLNH40AfF2botq0IA0lmHqohPBnviofCCaF8AJ,"Really love the UI, super cool to see something designed for gamers. Great app for meeting new people!",5,1,1.0.18,2020-11-15 00:37:23,,
gp:AOqpTOGbka81R613pXSBnC3ALfiqQj--lhlaMtjqnG3zZ6N-AtF5TYssqRincUIDKqnQwvQBMXWWea8FwdjrJA,Bethany Moffit,https://play-lh.googleusercontent.com/-rrPNIQw9nio/AAAAAAAAAAI/AAAAAAAAAAA/AMZuucnSje5YnJYi5tvAW70jIbhNbSv21A/photo.jpg,"Not LGBT friendly. There is no way to filter preferences, so you are probably swiping likes on people not interested and getting messages from people you wouldn't be interested in.",1,1,,2020-11-14 12:56:17,Hey Bethany! Thanks for the feedback. It is very important to us that Kippo is the most inclusive dating app in the world. We fixed this issue and you are now able to better control who get's to view your profile and message you.,2020-12-04 22:43:14
gp:AOqpTOEkPxbSL0u-QT0NtLlIKPZe3SxWO9Svu1HfyFCbDEFK_cpYdUw-xgvalmbnNCnijpK_BQ0RZVU10KxmHQ,Jamie Hood,https://play-lh.googleusercontent.com/a-/AOh14GhecGJmFioEHCwlLf4ge7JjsP1RrbdoL9XsVSzs,"Its a solid concept. I gave it a try for a couple weeks but i didnt get a single match, whereas on other dating apps i do get matches. Its hard to justify limiting swipes when you are getting no matches. I think it needs to become more popular before limiting.",2,5,1.0.18,2020-11-13 19:24:34,,
gp:AOqpTOHrj8QpLQEXyRhlVPsKRmZ-qG3mBimmROrr9nz3GYIaIIOKAFFHbTTUYLJoIXZ-vDsFnpNqkEoehJexZw,Listener Watcher,https://play-lh.googleusercontent.com/a-/AOh14GhvOwQoIWP5TFX-CS49gL4Zlj01KyJ2K4hCRHXD,i saw them roast someone on Instagram🤣🤣🤣,5,1,1.0.21,2020-11-12 23:20:25,oops XD,2020-12-04 22:43:32
gp:AOqpTOHI_D_xD5---4DeBKK_5iN7D4c--WxPsv_BbjD5JKGnc34f9N4IAi3joDjhR8DMCRumklVLi4wC-kc0lA,tommy Gunz,https://play-lh.googleusercontent.com/a-/AOh14Gg-q13Fhi92VvAProaF2gv3ov9JPW5gbXp3qkzX,Although it's a nice design they lost me at forcing me to add my phone number and overpriced premium with hardly any users I was hoping for it not to be another money monster for now I will stick to the less expensive options atleast be honest and say that the app hasn't fully populated instead of acting like there is so many options with so little people and greed shouldn't be the motivation in a new app but that's just my opinion maybe I will come back a later date.,1,6,1.0.18,2020-11-12 14:03:16,Hey! So I'm a little confused here because we purposefully priced Kippo to be lower than all the other major dating apps. Kippo is free to use and only $10 a month for Kippo Infinity. The phone number login is the safest login and a standard across most apps including pretty much every dating app.,2020-12-04 22:44:48
gp:AOqpTOEOwq5mXuCCiYDY0TndwSmtT-yhh9rbEpFo3Dw9YyvFZtQiOaj9LZvfxJHkKfDALUq-RIvcfL4eHMLVTA,VXEO,https://play-lh.googleusercontent.com/a-/AOh14GiA7cji_jKBUtZe6Npx1FIjjLKvnF4jU8weVIdj2A,I wish you could sign up with your email or something instead of just using your phone number😕,2,0,,2020-11-11 21:01:06,We use phone login because it is more secure that email. We don't want the app to get run over with bots and scam accounts like other dating apps and it is much easier for bots to make multiple accounts through email.,2020-12-04 22:45:45
gp:AOqpTOE_QcwDbR0SaMOJAKgHb45PKs7dbucjavOqHDirWNvAmL4oQuu9akHLbTytxS-56zWiM7UAZj1iPS0ZxQ,Spectrum Warrior,https://play-lh.googleusercontent.com/a-/AOh14GhaoXlyiXWPYWxe4RLSVwLDrIfkF95xD7Q2-8oOJGA,"I like the concept of this app but I absolutely hate how our profiles show our location. As a woman that is very disconcerting, I live in a small town and I'm not comfortable with putting out there where I live. deleted my profile and uninstalled the app for this reason alone. Maybe if we are given the option to keep our location to ourselves unless we decide to disclose it then I might redownload. Until then I'd rather not.",2,2,,2020-11-11 17:57:20,,
gp:AOqpTOF2pu_xF9TBBrCBnOhsH8T7TBhh1wUhIjr955g3MkT3R3CR32etUzXOm6v64iWJuHEnkp1xyIYY8Rtseg,CamoYuki,https://play-lh.googleusercontent.com/a-/AOh14GjztmxaEzw3yjVjxn2IM6UI8QAMDCaPF6ifWgD8AA,"I think overall Kippo is okay. It helped a lot once they added cards that you can write on. I appreciate a dating app made for gamers, but the population on it isn't great. Kippo can't necessarily choose how many people download the app though. Contrary to many other reviews, I actually like that I can only like/dislike 30 profiles a day on the free version because it keeps me from spending too much time hopelessly scrolling through countless profiles that will lead nowhere for me",4,1,1.0.18,2020-11-11 10:42:27,,
gp:AOqpTOEJPcioZXpmoIS9XhWaNEsie3lH3pHK3g_w6cY2TNgSgwVBHFCRDMwyakGbn4uuq04MeTqbum8YxAfE0w,Samantha,https://play-lh.googleusercontent.com/a-/AOh14Gg3vFb67WVYzI3aRte_RS5KIWYGSLc_Q85LIwQLZQ,"It has really cool features, and seems pretty legit. But I havent had hardly any matches. I like at least 20 dudes a day and look in my matches and its a ghost town.. As opposed to Bumble or Tinder where I feel like every other person I swipe right on I get matched with. Im not sure why that is. I wish there was a way to see who you liked so you can just go ahead and message them without having to match. In my opinion its likely because a lot of profiles are bots.",2,9,1.0.18,2020-11-10 18:23:06,"Hey Samantha. If you would like, I can take a look at your account to see if everything is normal. Email me sup@kippoapp.com. We have sophisticated AI that removes bots and we rarely have any bots on Kippo if any.",2020-12-04 22:47:20
gp:AOqpTOHzA3Bw6XDjxCVvy1G-rsDEb4sCRC-WNlzDPcNvLxvMqkwltUzk68-X0ehDs9aJ7XYQnLyQLfeNC_W1SQ,Chase Barajas,https://play-lh.googleusercontent.com/a-/AOh14GhqrKgPx0Mz_2cZWKbr2SOxv5ymS-W6SaIF4Vn1,"Good concept, needs improvements as well as more diverse ways of expressing yourself. 1 DM a day is incredibly frustrating. It makes you nervous about using it up incase someone is not LGBT as well. It needs more people and better opportunities for matches. As well as being able to see who you've already hit the heart for in case you'd like to go back and DM someone.",4,25,1.0.18,2020-11-09 18:10:20,Hey Chase thanks so much for your review! Tinder gives you 0 superlikes for free so though we were being nice with 1 DM per day but we've been discussing increasing this number. We recently upgraded our algorithm to better server the LGBT community so the experience should be much better. Shoot me an email sup@kippo.com for a free month of Infinity,2020-12-04 22:49:20
gp:AOqpTOGegAdUxwDtBwRSmy3Y3biCFSd_fGjhWXW1akK4sNybsbWsYQlnXm_wd8fFpuYVG6ywQyLdv2xsIom9-w,Raw-Kin Bleachfan,https://play-lh.googleusercontent.com/a-/AOh14Gg_1I4ZHDKsUiIqjT09nsPqIeKHi09fERygLu3t,I NEVER GOT ANY MATCHES.,1,2,,2020-11-09 17:19:56,,
gp:AOqpTOHaOIO52rfQJoCLjCuinU7b8QCsJDBe_5AX4iSV-J5msJ99gL247A-AnwUZ-u3NYOuOV3lMVr7q0Gnj9A,Joel Fennimore,https://play-lh.googleusercontent.com/a-/AOh14GhrMT2TiEbwqWnY3wm-FsKvpmFGZzBx19eF_JKm4iU,"Edit: Changed rating to 4 stars, update has been nice, and thank you for your response. Still wish you could write a bio without using a card though, but that's just my preference perhaps. I'm excited to see this app grow even further in the future!",4,8,1.0.18,2020-11-09 07:58:47,"Hey Joel. Have you checked out the ""text prompt"" card? You can choose from a set of prompts or write a freeform bio.",2020-10-15 03:58:41
gp:AOqpTOFvLl31jMXOKAiZdX3S2EbJV81YUo3fgy0BrnQ8rIx6orU-TO04hrGwSjCCFAjzxQEWE8zaNiutOEpE-Q,Chris Gifford,https://play-lh.googleusercontent.com/a-/AOh14GguV0HlrRDkdPfFu_imK_NbxRXvV1Hi0efqHDkDJz8,"I absolutely love this app, I have yet to get a match because of the abismal user count. But this app is elegant and very well made. While YES it's has a subscription if you want to have more than the limited about of matches, I think the price is really fair for the time the Devs took to make the app so tailored to gamers and make it as beautiful as it is. I will say the limited number of likes/nos you have is actually a blessing if there's not a while lot of people in your area on the app",5,19,1.0.18,2020-11-08 15:29:34,Hey Chris! Thanks so much for the feedback. Kippo is still pretty new but we are growing quickly. There are more people to browse everyday and we are working hard to get the word out there about Kippo so that the community continues to grow! It just gets better from here!,2020-12-04 22:50:51
gp:AOqpTOEmB3qoVCKnVZkV5VFJg0vk12YQ1bj9-1q05GPOHTLzWxSnwpZZ72ZeEp2r5SIFvPxX1EUexuWlGZRzig,Chelsea Kopp,https://play-lh.googleusercontent.com/-4s-pxKVMuPk/AAAAAAAAAAI/AAAAAAAAAAA/AMZuuclmkeQBGJ-E-aJAz4LLFt-Vv8aYJA/photo.jpg,I'm gay why can men see me a message me theres no way for me to block men completely.,1,2,1.0.18,2020-11-08 01:26:38,,
gp:AOqpTOGz_nOv3I_81sbLfjQnGMaSkqOmOkoBrtoIw-Uu6zNw6ZaEWphqPm-LH3ik5R9m0A9tqB37umsN_dviuA,Jerome Samek,https://play-lh.googleusercontent.com/a-/AOh14GjeMaXAyYT9YO8pSZOMN1g49DrF_mecUqRGpKD5iQ,"Solid and creative concept I thoroughly enjoy the look and feel of the app, it has a clever way of allowing you to customize your profile, without drowning visitors to your page in excessive nonsense. The only down side this app has currently is it's lack of users. This isn't necessarily a problem, because as of writing this I believe the app is still relatively new and is likely to grow quickly among the ever widening gaming community.",5,41,1.0.18,2020-11-07 19:54:54,Hey Jerome Thanks so much for your review and kind words. We are working hard on getting the word about about Kippo and there are thousands of new people making profiles every day! Thank you for being one of our first users! <3,2020-12-04 22:52:30
gp:AOqpTOF8ivlW8PofNhJ8Iiiii5Ea7wSS1_1K9-m4ovf95w3_6zefexNa9yXp8-TXyWwBfiZ1Hw8GQBQgAF6ghw,Derek Terry,https://play-lh.googleusercontent.com/a-/AOh14GiWADHx5_MZgPiuG6rxix0wWvTWkz5odu4HCLzW,Amazing. There should be more apps like this,5,2,1.0.17,2020-11-07 18:21:30,,
gp:AOqpTOHuTkkleSyR2h6Uls0hf5dorY3CHA_0KYWp9-rKNLdFZXhWCwWQ_iKU6N09erleW4IM1TmlDyS_f9Yexg,Luiza Nacif Coelho,https://play-lh.googleusercontent.com/a-/AOh14GhJlvdRMXKJosuIXn75MTcaqvuD7sW9Pr3pk-2koPA,"It's definitely getting there. I dont think people know there is a button to write a bio, but it s under write a haiku. Make that more obvious for people. Also, lose the 30 people per day only thing. Dont put the bio as a card. Put is as something optional, but separate from the cards. Include more games. Games like lego star wars and VRchat are not there. Put an option to personalize each person s role in a game. I wish i could write more but word limit is a thing.",3,8,1.0.18,2020-11-07 12:53:48,Thanks for the detailed feedback. The missing games have been fixed. We thought 30 was a lot compared to other apps. We don't want to become a spam swiping app but we're brainstorming other solutions.,2020-12-04 22:55:24
gp:AOqpTOFOcuj3hNpB9ku6aqbPUDOb-kvvBK2I0KqlIKUn3NUQc2qnJkG2d13shb1HvBluJGSMN0K-tlV-e5NUyQ,Julia Colthirst,https://play-lh.googleusercontent.com/a-/AOh14GhtfaRQOelS6jl2RImEtaaqSVJrrBzZmTgVq6wJ,Optional.,5,1,1.0.18,2020-11-07 10:28:06,,
gp:AOqpTOGi601f_-IeFl7ZzyXYJhdL2Pd0H8bgofwf7RFP8vpz_Md8wve9BdaPEBDCgFdMFxQ5eA9WtnCH5ydXzA,Rebecca Blake,https://play-lh.googleusercontent.com/a-/AOh14Ggltg4gMb6Q7v3jdFzIPIY_PdVxzXxO8qgODwCD,Really helpful.,5,2,1.0.18,2020-11-07 05:49:41,,
gp:AOqpTOG-IUJuuQ1tsnNCB77JHCXJ072SbmfQErjjMiQ4i_n-C_q25eiTC1ov1wstjSWpyAcIwqi56wfAmnkk1g,Shelby Forbes,https://play-lh.googleusercontent.com/--MWbnbYmM2c/AAAAAAAAAAI/AAAAAAAAAAA/AMZuucki6hENjYhpnx9gZUeTJxJjsdvPEg/photo.jpg,I love it its very usefull,5,2,1.0.18,2020-11-07 00:16:51,,
gp:AOqpTOFJGhSz8ASf9KbnAdjI10D3RopcHeiRFrE0A2emyKxxyWwrxKDEpWCXoAoI4WWytpUJAH2AMaOy5OE8dQ,Charlotte Craig,https://play-lh.googleusercontent.com/-iS4fqjOKE6o/AAAAAAAAAAI/AAAAAAAAAAA/AMZuucm42fHN9cMHA3G826YupZPbPZQclw/photo.jpg,Better then I expected,5,1,1.0.17,2020-11-06 23:28:46,,
gp:AOqpTOFqZqzbcpug4B5wC8i_-YhbpvLsF3LIWfKyqZ_U0Q_f22XDqbPYocHK23E14KQJkEhGuPM7xowhmoWlzQ,Reagan Townsend,https://play-lh.googleusercontent.com/a-/AOh14GhMPNzEsoe9zwR4slJfX0Ob1115e7rrRlCvg41_,very useful app,5,2,1.0.17,2020-11-06 17:32:40,,
gp:AOqpTOGVcNeGYSRFF5TTk_R80HtJbGf9IXi-W1eH7hDxuV-93LazwPzhijdtRi8mlpdkwE8pVLa7mJ2WSb52VA,Maxine McFarlane,https://play-lh.googleusercontent.com/a-/AOh14GiZXDK8hwkvgluILpimxBo8xOBDbBFMjUKS1OujIA,No one replies. The app is dead. I got only 30 people a day. No matches. Its for gamers but is NOTHING about gaming. I can't delete my account too.,1,4,1.0.17,2020-11-06 03:53:12,,
gp:AOqpTOEmTc3s6yXvNLXW7NziGZn9Kf9ifXZWsgd1IDX2G1iYLaIWl6DBsuvEAsC046z_o1p922BhO4JvlU9nkA,위보라,https://play-lh.googleusercontent.com/a-/AOh14Gg0i54zkv9mau19OFzGv1qT3BvXe_8ZqzYv8GjZqg,So when I try to make a new card it cuts off and I can't even fill it out.,2,1,1.0.18,2020-11-05 09:52:40,,
gp:AOqpTOHbEhyOoxUUQfpdtxilq9EFX6nZGaubdA2nyVzb8vTOooFCh-e3Z9gE4D5bABCo-pCdW2m04aT3Bpk9Lw,Stefen Perez,https://play-lh.googleusercontent.com/a-/AOh14GgLePLA2iWGV7dPof9RANG6cIfSOO9JLUMBjdCY,Need more then 30 swipes. Or dont count the dislikes as a point. Also needs more people. You guys might wanna market..,4,2,1.0.17,2020-11-04 16:41:13,,
gp:AOqpTOFzs7SAcwc1BsBlnaTc5jnonplRJrJivCFqHwIaZm15pCHMtXzxCSz1Zt7Hka7-Gh891qNaIQsU2nqzMw,Bob Klingfus,https://play-lh.googleusercontent.com/a-/AOh14Gg6-jY5_T0TI9SRNDlvABlRRcz55x-ePbP11DU8,Solid so far. Clean UI. Live in Tucson AZ so there's plenty of people. Broke dudes bitching about a $10 premium membership cant afford to take a girl on a date anyway. Its less than the cost of you gamepass or ps plus.,4,0,1.0.17,2020-11-04 08:47:41,Thanks for your review! I couldn't say it so I'm glad you did XD,2020-12-04 22:57:00
gp:AOqpTOGll2HMUS_vaQbbhHEeh-xWntDUhgEui83GXRfsqOtd9AxDAfch-6LNiKiltsKwSUdHUfLo798XHnE6qA,gianna lesles Lennix,https://play-lh.googleusercontent.com/a-/AOh14GjNzgJh77s6TJ-LKYAR5oV7TMtBV8he0GkUTNsu,lesles,5,0,,2020-11-04 00:22:11,,
gp:AOqpTOHJzKcLy-yYHIhCA2sSZ61buU581DWGLXgwnMnD_YFskokPeYXOJAwKuTTf7b44dXphSnFWDYtS_pJU_w,Baazi Hassan,https://play-lh.googleusercontent.com/-AOZALux0p7I/AAAAAAAAAAI/AAAAAAAAAAA/AMZuuck-aq1A3ujMbVQCscVx4mbIimQvgA/photo.jpg,"The Kippo dating app is great app in the app store, you must download it and see it....",5,1,1.0.17,2020-11-03 22:27:59,,
gp:AOqpTOFjejT005sZKLMZFJaGbPHfLpSDx9c2R1X7neCIsRm1lGYPobtFnhru6aF8xfNm6u8bvhBt7HLMruG6-A,Dj Megalax,https://play-lh.googleusercontent.com/a-/AOh14Gis1ReMOfkPHQRGpMBVwDvvi7TPRdDCOdRBYLl4qnE,Not bad. I like it so far. The UI quite beautiful.,5,1,1.0.17,2020-11-03 04:26:31,,
